{
  "ts": 1792003000000,
  "bot": {
    "name": "Clyde",
    "dimension": "overworld",
    "position": {
      "x": 55.5,
      "y": 70,
      "z": 12.5
    },
    "yaw": 1.6,
    "pitch": 0.0,
    "health": 20,
    "food": 18,
    "oxygen": 20,
    "xpLevel": 3,
    "gameMode": "survival",
    "onGround": true,
    "inWater": false,
    "inLava": false
  },
  "world": {
    "timeOfDay": 6000,
    "phase": "day",
    "raining": false,
    "thundering": false
  },
  "action": {
    "id": 12,
    "type": "goto",
    "params": {
      "x": 96,
      "y": 71,
      "z": 40,
      "range": 1
    },
    "status": "running",
    "startedAt": 1792002979000,
    "elapsedMs": 21000,
    "progress": "49.6 blocks remaining"
  },
  "lastAction": null,
  "inventory": {
    "used": 3,
    "total": 36,
    "held": null,
    "items": [
      {
        "name": "oak_log",
        "count": 6
      },
      {
        "name": "cobblestone",
        "count": 12
      },
      {
        "name": "bread",
        "count": 3
      }
    ]
  },
  "entities": {
    "players": [],
    "hostiles": [],
    "passives": [],
    "items": []
  },
  "blocks": [],
  "events": [
    {
      "ageMs": 21000,
      "type": "action.start",
      "text": "goto x=96 y=71 z=40 range=1"
    },
    {
      "ageMs": 20000,
      "type": "action.log",
      "text": "49.6 blocks remaining"
    },
    {
      "ageMs": 15000,
      "type": "action.log",
      "text": "49.6 blocks remaining"
    },
    {
      "ageMs": 10000,
      "type": "action.log",
      "text": "49.6 blocks remaining; path blocked, recomputing"
    },
    {
      "ageMs": 5000,
      "type": "action.log",
      "text": "49.6 blocks remaining; path blocked, recomputing"
    }
  ]
}
