{
  "ts": 1792003600000,
  "bot": {
    "name": "Clyde",
    "dimension": "overworld",
    "position": {
      "x": 12.5,
      "y": 64,
      "z": -30.5
    },
    "yaw": 1.6,
    "pitch": 0,
    "health": 20,
    "food": 18,
    "oxygen": 20,
    "xpLevel": 3,
    "gameMode": "survival",
    "onGround": true,
    "inWater": false,
    "inLava": false
  },
  "world": {
    "timeOfDay": 6000,
    "phase": "day",
    "raining": false,
    "thundering": false
  },
  "action": {
    "id": 14,
    "token": "fixture-collect-14",
    "type": "collect",
    "params": {
      "block": "oak_log",
      "count": 10
    },
    "status": "running",
    "startedAt": 1792003582000,
    "elapsedMs": 18000,
    "progress": "collected 6/10 oak_log",
    "collected": 6
  },
  "lastAction": null,
  "inventory": {
    "used": 3,
    "total": 36,
    "held": "stone_axe",
    "items": [
      {
        "name": "oak_log",
        "count": 6
      },
      {
        "name": "cobblestone",
        "count": 12
      },
      {
        "name": "bread",
        "count": 3
      }
    ]
  },
  "entities": {
    "players": [],
    "hostiles": [],
    "passives": [],
    "items": []
  },
  "blocks": [
    {
      "name": "oak_log",
      "count": 14,
      "nearest": 3.2,
      "nearestPos": {
        "x": 14,
        "y": 64,
        "z": -28
      }
    }
  ],
  "events": [
    {
      "ageMs": 18000,
      "type": "action.start",
      "text": "collect block=oak_log count=10"
    },
    {
      "ageMs": 13000,
      "type": "action.log",
      "text": "collected 2/10 oak_log"
    },
    {
      "ageMs": 8500,
      "type": "action.log",
      "text": "collected 4/10 oak_log"
    },
    {
      "ageMs": 3000,
      "type": "action.log",
      "text": "collected 6/10 oak_log"
    },
    {
      "ageMs": 2900,
      "type": "pickup",
      "text": "picked up oak_log x1"
    }
  ]
}
