{
  "ts": 1792004200000,
  "bot": {
    "name": "Clyde",
    "dimension": "overworld",
    "position": {
      "x": 12.5,
      "y": 64,
      "z": -30.5
    },
    "yaw": 1.6,
    "pitch": 0.0,
    "health": 20,
    "food": 18,
    "oxygen": 20,
    "xpLevel": 3,
    "gameMode": "survival",
    "onGround": true,
    "inWater": false,
    "inLava": false
  },
  "world": {
    "timeOfDay": 6000,
    "phase": "day",
    "raining": false,
    "thundering": false
  },
  "action": null,
  "lastAction": null,
  "inventory": {
    "used": 3,
    "total": 36,
    "held": null,
    "items": [
      {
        "name": "oak_log",
        "count": 6
      },
      {
        "name": "cobblestone",
        "count": 12
      },
      {
        "name": "bread",
        "count": 3
      }
    ]
  },
  "entities": {
    "players": [
      {
        "name": "Bonnie",
        "distance": 12.4,
        "direction": "S",
        "dy": 0,
        "position": {
          "x": 13.0,
          "y": 64,
          "z": -18.1
        },
        "health": 20
      }
    ],
    "hostiles": [],
    "passives": [
      {
        "name": "chicken",
        "distance": 6.0,
        "direction": "E",
        "dy": 0,
        "position": {
          "x": 18.5,
          "y": 64,
          "z": -30.0
        },
        "health": 4
      }
    ],
    "items": []
  },
  "blocks": [],
  "events": [
    {
      "ageMs": 1800,
      "type": "chat",
      "text": "<Bonnie> Clyde, can you come help me carry these logs back to the house?"
    }
  ]
}
