{
  "ts": 1792001200000,
  "bot": {
    "name": "Clyde",
    "dimension": "overworld",
    "position": {
      "x": 12.5,
      "y": 64,
      "z": -30.5
    },
    "yaw": 1.6,
    "pitch": 0.0,
    "health": 4,
    "food": 0,
    "oxygen": 20,
    "xpLevel": 3,
    "gameMode": "survival",
    "onGround": true,
    "inWater": false,
    "inLava": false
  },
  "world": {
    "timeOfDay": 6000,
    "phase": "day",
    "raining": false,
    "thundering": false
  },
  "action": null,
  "lastAction": null,
  "inventory": {
    "used": 2,
    "total": 36,
    "held": null,
    "items": [
      {
        "name": "cobblestone",
        "count": 30
      },
      {
        "name": "stone_pickaxe",
        "count": 1
      }
    ]
  },
  "entities": {
    "players": [],
    "hostiles": [],
    "passives": [],
    "items": []
  },
  "blocks": [],
  "events": [
    {
      "ageMs": 12000,
      "type": "damage",
      "text": "Clyde was hurt by starvation (health 5)"
    },
    {
      "ageMs": 2000,
      "type": "damage",
      "text": "Clyde was hurt by starvation (health 4)"
    }
  ]
}
