{
  "ts": 1792005400000,
  "bot": {
    "name": "Clyde",
    "dimension": "overworld",
    "position": {
      "x": 12.5,
      "y": 64,
      "z": -30.5
    },
    "yaw": 1.6,
    "pitch": 0.0,
    "health": 20,
    "food": 18,
    "oxygen": 20,
    "xpLevel": 3,
    "gameMode": "survival",
    "onGround": true,
    "inWater": false,
    "inLava": false
  },
  "world": {
    "timeOfDay": 6000,
    "phase": "day",
    "raining": false,
    "thundering": false
  },
  "action": null,
  "lastAction": null,
  "inventory": {
    "used": 3,
    "total": 36,
    "held": null,
    "items": [
      {
        "name": "oak_log",
        "count": 6
      },
      {
        "name": "cobblestone",
        "count": 12
      },
      {
        "name": "bread",
        "count": 3
      }
    ]
  },
  "entities": {
    "players": [
      {
        "name": "Bonnie",
        "distance": 20.1,
        "direction": "SE",
        "dy": 0,
        "position": {
          "x": 26.8,
          "y": 64,
          "z": -16.6
        },
        "health": 20
      },
      {
        "name": "Steve",
        "distance": 22.7,
        "direction": "SE",
        "dy": 0,
        "position": {
          "x": 29.0,
          "y": 64,
          "z": -15.0
        },
        "health": 20
      }
    ],
    "hostiles": [],
    "passives": [],
    "items": []
  },
  "blocks": [],
  "events": [
    {
      "ageMs": 2500,
      "type": "chat",
      "text": "<Bonnie> Steve, want to go mining after dinner?"
    },
    {
      "ageMs": 900,
      "type": "chat",
      "text": "<Steve> sure, meet you at the cave"
    }
  ]
}
